{
  "id": "CA-2026-0001",
  "finding_id": "FIND-2026-0001",
  "date_assigned": "2026-07-05",
  "description": "Correct emergency-workflow SAPA/OSHA-KR citations: replace '중대재해처벌법 Art 7' with 'Art 4' in the 6 affected workflows; fix disaster-response's invalid 'OSHA-KR Art 5' with 'OSHA-KR Article 54'.",
  "responsible_party": "Safety governance / legal-agent verification",
  "due_date": "2026-07-05",
  "completed_date": "2026-07-05",
  "status": "verified",
  "verification_note": "bun scripts/safety-audit.ts re-run after fix — 618 files checked, 0 errors."
}
